pre-tuned_data/FamilySeer/NVIDIA_V100/vit_huge-NHWC-B1-cuda.json.best.json
{"i": [["[\"9847f8cc0b305137f49f2c5c0c8ab25d\", 1, 1280, 1000, 1280, 1000, 1, 1000]", "cuda -keys=cuda,gpu -arch=sm_70 -max_num_threads=1024 -thread_warp_size=32", [-1, 16, 64, 49152, 2147483647, 1024, 8, 32], "", 0, []], [[], [["SP", 4, 1, 1000, [32], 1], ["AN", 4, 2, 6], ["FSP", 2, 2, 0, 1], ["AN", 2, 3, 6], ["CA", 2, 4, 1], ["FU", 4, [0, 1]], ["AN", 4, 0, 5], ["PR", 2, 0, "auto_unroll_max_step$1024"]]]], "r": [[3.73346e-05], 0, 2.13928, 1639138135], "v": "v0.6"}
{"i": [["[\"61f56dfd63fda28bc8bcf85739c8e9e3\", 197, 5120, 1280, 5120, 197, 1280]", "cuda -keys=cuda,gpu -arch=sm_70 -max_num_threads=1024 -thread_warp_size=32", [-1, 16, 64, 49152, 2147483647, 1024, 8, 32], "", 0, []], [[], [["CHW", 2, "local"], ["SP", 2, 0, 197, [1, 197, 1, 1], 1], ["SP", 2, 5, 1280, [4, 2, 1, 2], 1], ["SP", 2, 10, 5120, [5, 8], 1], ["RE", 2, [0, 5, 1, 6, 2, 7, 10, 11, 3, 8, 12, 4, 9]], ["FSP", 3, 0, 1, 3], ["FSP", 3, 4, 2, 3], ["RE", 3, [0, 4, 1, 5, 2, 6, 3, 7]], ["CA", 2, 3, 5], ["CHR", 1, "shared", [2]], ["CA", 2, 3, 6], ["CHR", 0, "shared", [3]], ["CA", 1, 4, 6], ["FU", 5, [0, 1]], ["AN", 5, 0, 5], ["FU", 5, [1, 2]], ["AN", 5, 1, 4], ["FU", 5, [2, 3]], ["AN", 5, 2, 6], ["FU", 3, [0, 1]], ["SP", 3, 0, 160, [2], 1], ["AN", 3, 1, 2], ["FFSP", 3, 0, [2, 1], 1, 1], ["AN", 3, 1, 6], ["FU", 1, [0, 1]], ["SP", 1, 0, 40, [4], 1], ["AN", 1, 1, 2], ["FFSP", 1, 0, [2, 1], 1, 1], ["AN", 1, 1, 6], ["PR", 4, 0, "auto_unroll_max_step$16"]]]], "r": [[0.000477168], 0, 2.25366, 1639145672], "v": "v0.6"}
{"i": [["[\"61f56dfd63fda28bc8bcf85739c8e9e3\", 197, 1280, 5120, 1280, 197, 5120]", "cuda -keys=cuda,gpu -arch=sm_70 -max_num_threads=1024 -thread_warp_size=32", [-1, 16, 64, 49152, 2147483647, 1024, 8, 32], "", 0, []], [[], [["CHW", 2, "local"], ["SP", 2, 0, 197, [1, 197, 1, 1], 1], ["SP", 2, 5, 5120, [2, 1, 16, 2], 1], ["SP", 2, 10, 1280, [10, 4], 1], ["RE", 2, [0, 5, 1, 6, 2, 7, 10, 11, 3, 8, 12, 4, 9]], ["FSP", 3, 0, 1, 3], ["FSP", 3, 4, 2, 3], ["RE", 3, [0, 4, 1, 5, 2, 6, 3, 7]], ["CA", 2, 3, 5], ["CHR", 1, "shared", [2]], ["CA", 2, 3, 6], ["CHR", 0, "shared", [3]], ["CA", 1, 4, 6], ["FU", 5, [0, 1]], ["AN", 5, 0, 5], ["FU", 5, [1, 2]], ["AN", 5, 1, 4], ["FU", 5, [2, 3]], ["AN", 5, 2, 6], ["FU", 3, [0, 1]], ["SP", 3, 0, 512, [2], 1], ["AN", 3, 1, 2], ["FFSP", 3, 0, [2, 1], 1, 1], ["AN", 3, 1, 6], ["FU", 1, [0, 1]], ["SP", 1, 0, 16, [4], 1], ["AN", 1, 1, 2], ["FFSP", 1, 0, [2, 1], 1, 1], ["AN", 1, 1, 6], ["PR", 4, 0, "auto_unroll_max_step$1024"]]]], "r": [[0.000381168], 0, 2.9937, 1639148174], "v": "v0.6"}
{"i": [["[\"61f56dfd63fda28bc8bcf85739c8e9e3\", 197, 1024, 1280, 1024, 197, 1280]", "cuda -keys=cuda,gpu -arch=sm_70 -max_num_threads=1024 -thread_warp_size=32", [-1, 16, 64, 49152, 2147483647, 1024, 8, 32], "", 0, []], [[], [["CHW", 2, "local"], ["SP", 2, 0, 197, [1, 197, 1, 1], 1], ["SP", 2, 5, 1280, [2, 1, 4, 2], 1], ["SP", 2, 10, 1024, [2, 8], 1], ["RE", 2, [0, 5, 1, 6, 2, 7, 10, 11, 3, 8, 12, 4, 9]], ["FSP", 3, 0, 1, 3], ["FSP", 3, 4, 2, 3], ["RE", 3, [0, 4, 1, 5, 2, 6, 3, 7]], ["CA", 2, 3, 5], ["CHR", 1, "shared", [2]], ["CA", 2, 3, 6], ["CHR", 0, "shared", [3]], ["CA", 1, 4, 6], ["FU", 5, [0, 1]], ["AN", 5, 0, 5], ["FU", 5, [1, 2]], ["AN", 5, 1, 4], ["FU", 5, [2, 3]], ["AN", 5, 2, 6], ["FU", 3, [0, 1]], ["SP", 3, 0, 256, [1], 1], ["AN", 3, 1, 2], ["FFSP", 3, 0, [2, 1], 1, 1], ["AN", 3, 1, 6], ["FU", 1, [0, 1]], ["SP", 1, 0, 32, [4], 1], ["AN", 1, 1, 2], ["FFSP", 1, 0, [2, 1], 1, 1], ["AN", 1, 1, 6], ["PR", 4, 0, "auto_unroll_max_step$1024"]]]], "r": [[0.000132204], 0, 2.2008, 1639150907], "v": "v0.6"}
{"i": [["[\"61f56dfd63fda28bc8bcf85739c8e9e3\", 197, 1280, 3072, 1280, 197, 3072]", "cuda -keys=cuda,gpu -arch=sm_70 -max_num_threads=1024 -thread_warp_size=32", [-1, 16, 64, 49152, 2147483647, 1024, 8, 32], "", 0, []], [[], [["CHW", 2, "local"], ["SP", 2, 0, 197, [1, 197, 1, 1], 1], ["SP", 2, 5, 3072, [1, 1, 3, 16], 1], ["SP", 2, 10, 1280, [20, 2], 1], ["RE", 2, [0, 5, 1, 6, 2, 7, 10, 11, 3, 8, 12, 4, 9]], ["FSP", 3, 0, 1, 3], ["FSP", 3, 4, 2, 3], ["RE", 3, [0, 4, 1, 5, 2, 6, 3, 7]], ["CA", 2, 3, 5], ["CHR", 1, "shared", [2]], ["CA", 2, 3, 6], ["CHR", 0, "shared", [3]], ["CA", 1, 4, 6], ["FU", 5, [0, 1]], ["AN", 5, 0, 5], ["FU", 5, [1, 2]], ["AN", 5, 1, 4], ["FU", 5, [2, 3]], ["AN", 5, 2, 6], ["FU", 3, [0, 1]], ["SP", 3, 0, 480, [1], 1], ["AN", 3, 1, 2], ["FFSP", 3, 0, [2, 1], 1, 1], ["AN", 3, 1, 6], ["FU", 1, [0, 1]], ["SP", 1, 0, 10, [2], 1], ["AN", 1, 1, 2], ["FFSP", 1, 0, [2, 1], 1, 1], ["AN", 1, 1, 6], ["PR", 4, 0, "auto_unroll_max_step$1024"]]]], "r": [[0.000288813], 0, 2.72841, 1639141642], "v": "v0.6"}
{"i": [["[\"61f56dfd63fda28bc8bcf85739c8e9e3\", 196, 768, 1280, 768, 196, 1280]", "cuda -keys=cuda,gpu -arch=sm_70 -max_num_threads=1024 -thread_warp_size=32", [-1, 16, 64, 49152, 2147483647, 1024, 8, 32], "", 0, []], [[], [["CHW", 2, "local"], ["SP", 2, 0, 196, [1, 4, 1, 7], 1], ["SP", 2, 5, 1280, [1, 64, 1, 1], 1], ["SP", 2, 10, 768, [16, 8], 1], ["RE", 2, [0, 5, 1, 6, 2, 7, 10, 11, 3, 8, 12, 4, 9]], ["FSP", 3, 0, 1, 3], ["FSP", 3, 4, 2, 3], ["RE", 3, [0, 4, 1, 5, 2, 6, 3, 7]], ["CA", 2, 3, 5], ["CHR", 1, "shared", [2]], ["CA", 2, 3, 6], ["CHR", 0, "shared", [3]], ["CA", 1, 4, 6], ["FU", 5, [0, 1]], ["AN", 5, 0, 5], ["FU", 5, [1, 2]], ["AN", 5, 1, 4], ["FU", 5, [2, 3]], ["AN", 5, 2, 6], ["FU", 3, [0, 1]], ["SP", 3, 0, 128, [2], 1], ["AN", 3, 1, 2], ["FFSP", 3, 0, [2, 1], 1, 1], ["AN", 3, 1, 6], ["FU", 1, [0, 1]], ["SP", 1, 0, 3584, [4], 1], ["AN", 1, 1, 2], ["FFSP", 1, 0, [2, 1], 1, 1], ["AN", 1, 1, 6], ["PR", 4, 0, "auto_unroll_max_step$512"]]]], "r": [[0.000118305], 0, 2.19194, 1639139066], "v": "v0.6"}
{"i": [["[\"d2a28fdf41e83222456f5a6e5bf8a24a\", 16, 197, 197, 16, 64, 197, 16, 197, 64]", "cuda -keys=cuda,gpu -arch=sm_70 -max_num_threads=1024 -thread_warp_size=32", [-1, 16, 64, 49152, 2147483647, 1024, 8, 32], "", 0, []], [[], [["CHW", 2, "local"], ["SP", 2, 0, 16, [1, 1, 1, 1], 1], ["SP", 2, 5, 197, [1, 197, 1, 1], 1], ["SP", 2, 10, 64, [1, 1, 8, 2], 1], ["SP", 2, 15, 197, [1, 1], 1], ["RE", 2, [0, 5, 10, 1, 6, 11, 2, 7, 12, 15, 16, 3, 8, 13, 17, 4, 9, 14]], ["FSP", 3, 0, 1, 3], ["FSP", 3, 4, 2, 3], ["FSP", 3, 8, 3, 3], ["RE", 3, [0, 4, 8, 1, 5, 9, 2, 6, 10, 3, 7, 11]], ["CA", 2, 3, 8], ["CHR", 1, "shared", [2]], ["CA", 2, 3, 9], ["CHR", 0, "shared", [3]], ["CA", 1, 4, 9], ["FU", 5, [0, 1, 2]], ["AN", 5, 0, 5], ["FU", 5, [1, 2, 3]], ["AN", 5, 1, 4], ["FU", 5, [2, 3, 4]], ["AN", 5, 2, 6], ["FU", 3, [0, 1, 2]], ["SP", 3, 0, 256, [1], 1], ["AN", 3, 1, 2], ["FFSP", 3, 0, [3, 2, 1], 1, 1], ["AN", 3, 1, 6], ["FU", 1, [0, 1, 2]], ["SP", 1, 0, 16, [1], 1], ["AN", 1, 1, 2], ["FFSP", 1, 0, [3, 2, 1], 1, 1], ["AN", 1, 1, 6], ["PR", 4, 0, "auto_unroll_max_step$0"]]]], "r": [[8.00512e-05], 0, 1.99194, 1639141884], "v": "v0.6"}
{"i": [["[\"d2a28fdf41e83222456f5a6e5bf8a24a\", 16, 197, 64, 16, 197, 64, 16, 197, 197]", "cuda -keys=cuda,gpu -arch=sm_70 -max_num_threads=1024 -thread_warp_size=32", [-1, 16, 64, 49152, 2147483647, 1024, 8, 32], "", 0, []], [[], [["CHW", 2, "local"], ["SP", 2, 0, 16, [1, 1, 2, 1], 1], ["SP", 2, 5, 197, [1, 1, 1, 1], 1], ["SP", 2, 10, 197, [1, 197, 1, 1], 1], ["SP", 2, 15, 64, [1, 8], 1], ["RE", 2, [0, 5, 10, 1, 6, 11, 2, 7, 12, 15, 16, 3, 8, 13, 17, 4, 9, 14]], ["FSP", 3, 0, 1, 3], ["FSP", 3, 4, 2, 3], ["FSP", 3, 8, 3, 3], ["RE", 3, [0, 4, 8, 1, 5, 9, 2, 6, 10, 3, 7, 11]], ["CA", 2, 3, 8], ["CHR", 1, "shared", [2]], ["CA", 2, 3, 9], ["CHR", 0, "shared", [3]], ["CA", 1, 4, 9], ["FU", 5, [0, 1, 2]], ["AN", 5, 0, 5], ["FU", 5, [1, 2, 3]], ["AN", 5, 1, 4], ["FU", 5, [2, 3, 4]], ["AN", 5, 2, 6], ["FU", 3, [0, 1, 2]], ["SP", 3, 0, 32, [4], 1], ["AN", 3, 1, 2], ["FFSP", 3, 0, [3, 2, 1], 1, 1], ["AN", 3, 1, 6], ["FU", 1, [0, 1, 2]], ["SP", 1, 0, 32, [1], 1], ["AN", 1, 1, 2], ["FFSP", 1, 0, [3, 2, 1], 1, 1], ["AN", 1, 1, 6], ["PR", 4, 0, "auto_unroll_max_step$512"]]]], "r": [[0.000102243], 0, 2.14715, 1639145869], "v": "v0.6"}
{"i": [["[\"cbd44ab40cd3043d1c2bce7ddb1f6392\", 1, 16, 197, 197, 1, 16, 197, 197]", "cuda -keys=cuda,gpu -arch=sm_70 -max_num_threads=1024 -thread_warp_size=32", [-1, 16, 64, 49152, 2147483647, 1024, 8, 32], "", 0, []], [[], [["SP", 4, 3, 197, [64], 1], ["AN", 4, 4, 6], ["FSP", 3, 3, 0, 1], ["AN", 3, 4, 6], ["CA", 3, 4, 2], ["CI", 2], ["FSP", 1, 3, 0, 1], ["AN", 1, 4, 6], ["CA", 1, 4, 2], ["FU", 4, [0, 1, 2]], ["AN", 4, 0, 5], ["PR", 1, 0, "auto_unroll_max_step$16"], ["PR", 3, 0, "auto_unroll_max_step$64"]]]], "r": [[8.40997e-06], 0, 1.92471, 1639138790], "v": "v0.6"}
{"i": [["[\"14d9fc1688d29869e365273068fa6d63\", 1, 197, 1280, 1, 197, 1]", "cuda -keys=cuda,gpu -arch=sm_70 -max_num_threads=1024 -thread_warp_size=32", [-1, 16, 64, 49152, 2147483647, 1024, 8, 32], "", 0, []], [[], [["SP", 2, 2, 1, [32], 1], ["AN", 2, 3, 6], ["FSP", 1, 3, 0, 1], ["AN", 1, 4, 6], ["CA", 1, 2, 2], ["FU", 2, [0, 1, 2]], ["AN", 2, 0, 5], ["PR", 1, 0, "auto_unroll_max_step$1024"]]]], "r": [[2.85302e-06], 0, 2.22712, 1639139237], "v": "v0.6"}
{"i": [["[\"a652a2dd5f50dc852e37cbe2df08a2a7\", 1, 197, 1280, 1, 197, 1, 1, 197, 1]", "cuda -keys=cuda,gpu -arch=sm_70 -max_num_threads=1024 -thread_warp_size=32", [-1, 16, 64, 49152, 2147483647, 1024, 8, 32], "", 0, []], [[], [["SP", 5, 2, 1, [32], 1], ["AN", 5, 3, 6], ["FSP", 4, 3, 0, 1], ["AN", 4, 4, 6], ["CA", 4, 5, 2], ["CI", 3], ["CI", 2], ["FU", 5, [0, 1, 2]], ["AN", 5, 0, 5], ["PR", 4, 0, "auto_unroll_max_step$512"]]]], "r": [[2.87817e-06], 0, 2.19805, 1639139261], "v": "v0.6"}
{"i": [["[\"7e0ee3e68202fb0e86f67b042b2e5f7a\", 1, 1280, 1, 1]", "cuda -keys=cuda,gpu -arch=sm_70 -max_num_threads=1024 -thread_warp_size=32", [-1, 16, 64, 49152, 2147483647, 1024, 8, 32], "", 0, []], [[], [["SP", 2, 1, 1, [32], 1], ["AN", 2, 2, 6], ["FSP", 1, 2, 0, 1], ["AN", 1, 3, 6], ["CA", 1, 2, 1], ["FU", 2, [0, 1]], ["AN", 2, 0, 5], ["PR", 1, 0, "auto_unroll_max_step$1024"]]]], "r": [[2.33881e-06], 0, 2.10373, 1639139372], "v": "v0.6"}
{"i": [["[\"5547501cabf367d8cffd9459ec18eb50\", 1, 1280, 1, 1, 1, 1]", "cuda -keys=cuda,gpu -arch=sm_70 -max_num_threads=1024 -thread_warp_size=32", [-1, 16, 64, 49152, 2147483647, 1024, 8, 32], "", 0, []], [[], [["SP", 5, 1, 1, [32], 1], ["AN", 5, 2, 6], ["FSP", 4, 2, 0, 1], ["AN", 4, 3, 6], ["CA", 4, 5, 1], ["CI", 3], ["CI", 2], ["FU", 5, [0, 1]], ["AN", 5, 0, 5], ["PR", 4, 0, "auto_unroll_max_step$1024"]]]], "r": [[2.44072e-06], 0, 2.28703, 1639139396], "v": "v0.6"}
