pre-tuned_data/AutoTVM/NVIDIA_V100/roberta_large.log
{"input": ["cuda -keys=cuda,gpu -arch=sm_70 -max_num_threads=1024 -model=unknown -thread_warp_size=32", "dense_large_batch.gpu", [["TENSOR", [128, 4096], "float32"], ["TENSOR", [1024, 4096], "float32"], null, "float32"], {}], "config": {"index": 140058, "code_hash": null, "entity": [["tile_x", "sp", [-1, 8, 4, 1]], ["tile_y", "sp", [-1, 4, 4, 1]], ["tile_k", "sp", [-1, 16, 1]]]}, "result": [[0.00046442566873065015], 0, 2.2515616416931152, 1649253323.3213801], "version": 0.2, "tvm_version": "0.9.dev0"}
{"input": ["cuda -keys=cuda,gpu -arch=sm_70 -max_num_threads=1024 -model=unknown -thread_warp_size=32", "dense_small_batch.gpu", [["TENSOR", [128, 4096], "float32"], ["TENSOR", [1024, 4096], "float32"], null, "float32"], {}], "config": {"index": 5, "code_hash": null, "entity": [["tile_k", "sp", [-1, 32]]]}, "result": [[0.0024267017580645164], 0, 1.0563850402832031, 1649253974.084527], "version": 0.2, "tvm_version": "0.9.dev0"}
{"input": ["cuda -keys=cuda,gpu -arch=sm_70 -max_num_threads=1024 -model=unknown -thread_warp_size=32", "dense_large_batch.gpu", [["TENSOR", [128, 1024], "float32"], ["TENSOR", [4096, 1024], "float32"], null, "float32"], {}], "config": {"index": 221777, "code_hash": null, "entity": [["tile_x", "sp", [-1, 4, 4, 1]], ["tile_y", "sp", [-1, 8, 4, 1]], ["tile_k", "sp", [-1, 16, 1]]]}, "result": [[0.00031918535106382974], 0, 2.2652368545532227, 1649254280.86818], "version": 0.2, "tvm_version": "0.9.dev0"}
{"input": ["cuda -keys=cuda,gpu -arch=sm_70 -max_num_threads=1024 -model=unknown -thread_warp_size=32", "dense_small_batch.gpu", [["TENSOR", [128, 1024], "float32"], ["TENSOR", [4096, 1024], "float32"], null, "float32"], {}], "config": {"index": 8, "code_hash": null, "entity": [["tile_k", "sp", [-1, 256]]]}, "result": [[0.002481125737704918], 0, 0.9982213973999023, 1649255116.6190913], "version": 0.2, "tvm_version": "0.9.dev0"}
{"input": ["cuda -keys=cuda,gpu -arch=sm_70 -max_num_threads=1024 -model=unknown -thread_warp_size=32", "dense_large_batch.gpu", [["TENSOR", [128, 1024], "float32"], ["TENSOR", [1024, 1024], "float32"], null, "float32"], {}], "config": {"index": 483258, "code_hash": null, "entity": [["tile_x", "sp", [-1, 8, 4, 1]], ["tile_y", "sp", [-1, 4, 4, 1]], ["tile_k", "sp", [-1, 8, 2]]]}, "result": [[0.00010961028564940963], 0, 1.8483164310455322, 1649255163.3436108], "version": 0.2, "tvm_version": "0.9.dev0"}
{"input": ["cuda -keys=cuda,gpu -arch=sm_70 -max_num_threads=1024 -model=unknown -thread_warp_size=32", "dense_small_batch.gpu", [["TENSOR", [128, 1024], "float32"], ["TENSOR", [1024, 1024], "float32"], null, "float32"], {}], "config": {"index": 6, "code_hash": null, "entity": [["tile_k", "sp", [-1, 64]]]}, "result": [[0.0002406364797230465], 0, 1.1957337856292725, 1649255881.1440606], "version": 0.2, "tvm_version": "0.9.dev0"}
{"input": ["cuda -keys=cuda,gpu -arch=sm_70 -max_num_threads=1024 -model=unknown -thread_warp_size=32", "dense_large_batch.gpu", [["TENSOR", [128, 1024], "float32"], ["TENSOR", [3072, 1024], "float32"], null, "float32"], {}], "config": {"index": 556217, "code_hash": null, "entity": [["tile_x", "sp", [-1, 4, 4, 1]], ["tile_y", "sp", [-1, 12, 4, 1]], ["tile_k", "sp", [-1, 16, 1]]]}, "result": [[0.0002032342592281879], 0, 3.382460594177246, 1649256687.3641028], "version": 0.2, "tvm_version": "0.9.dev0"}
{"input": ["cuda -keys=cuda,gpu -arch=sm_70 -max_num_threads=1024 -model=unknown -thread_warp_size=32", "dense_small_batch.gpu", [["TENSOR", [128, 1024], "float32"], ["TENSOR", [3072, 1024], "float32"], null, "float32"], {}], "config": {"index": 5, "code_hash": null, "entity": [["tile_k", "sp", [-1, 32]]]}, "result": [[0.0018446013048780488], 0, 0.9935944080352783, 1649257108.8978567], "version": 0.2, "tvm_version": "0.9.dev0"}
