pre-tuned_data/AutoTVM/NVIDIA V100/bert_large.log
{"input": ["cuda -keys=cuda,gpu -arch=sm_70 -max_num_threads=1024 -model=unknown -thread_warp_size=32", "dense_small_batch.gpu", [["TENSOR", [1, 1024], "float32"], ["TENSOR", [2, 1024], "float32"], null, "float32"], {}], "config": {"index": 7, "code_hash": null, "entity": [["tile_k", "sp", [-1, 128]]]}, "result": [[2.3872339586174027e-06], 0, 1.0562193393707275, 1649856261.7498515], "version": 0.2, "tvm_version": "0.9.dev0"}
{"input": ["cuda -keys=cuda,gpu -arch=sm_70 -max_num_threads=1024 -model=unknown -thread_warp_size=32", "dense_small_batch.gpu", [["TENSOR", [1, 1024], "float32"], ["TENSOR", [1024, 1024], "float32"], null, "float32"], {}], "config": {"index": 7, "code_hash": null, "entity": [["tile_k", "sp", [-1, 128]]]}, "result": [[5.214950967238309e-06], 0, 1.074061632156372, 1649856272.2163308], "version": 0.2, "tvm_version": "0.9.dev0"}
{"input": ["cuda -keys=cuda,gpu -arch=sm_70 -max_num_threads=1024 -model=unknown -thread_warp_size=32", "dense_large_batch.gpu", [["TENSOR", [128, 4096], "float32"], ["TENSOR", [1024, 4096], "float32"], null, "float32"], {}], "config": {"index": 1321702, "code_hash": null, "entity": [["tile_x", "sp", [-1, 2, 8, 1]], ["tile_y", "sp", [-1, 2, 8, 4]], ["tile_k", "sp", [-1, 4, 8]]]}, "result": [[0.00041070449661016945], 0, 1.6961207389831543, 1649856923.041887], "version": 0.2, "tvm_version": "0.9.dev0"}
{"input": ["cuda -keys=cuda,gpu -arch=sm_70 -max_num_threads=1024 -model=unknown -thread_warp_size=32", "dense_small_batch.gpu", [["TENSOR", [128, 4096], "float32"], ["TENSOR", [1024, 4096], "float32"], null, "float32"], {}], "config": {"index": 5, "code_hash": null, "entity": [["tile_k", "sp", [-1, 32]]]}, "result": [[0.0024265783709677417], 0, 1.0566575527191162, 1649857221.25087], "version": 0.2, "tvm_version": "0.9.dev0"}
{"input": ["cuda -keys=cuda,gpu -arch=sm_70 -max_num_threads=1024 -model=unknown -thread_warp_size=32", "dense_large_batch.gpu", [["TENSOR", [128, 1024], "float32"], ["TENSOR", [4096, 1024], "float32"], null, "float32"], {}], "config": {"index": 1697303, "code_hash": null, "entity": [["tile_x", "sp", [-1, 4, 8, 1]], ["tile_y", "sp", [-1, 8, 8, 1]], ["tile_k", "sp", [-1, 2, 8]]]}, "result": [[0.00027760106077981655], 0, 1.6264557838439941, 1649857956.2499092], "version": 0.2, "tvm_version": "0.9.dev0"}
{"input": ["cuda -keys=cuda,gpu -arch=sm_70 -max_num_threads=1024 -model=unknown -thread_warp_size=32", "dense_small_batch.gpu", [["TENSOR", [128, 1024], "float32"], ["TENSOR", [4096, 1024], "float32"], null, "float32"], {}], "config": {"index": 8, "code_hash": null, "entity": [["tile_k", "sp", [-1, 256]]]}, "result": [[0.0024809497540983602], 0, 1.0047204494476318, 1649858430.9699142], "version": 0.2, "tvm_version": "0.9.dev0"}
{"input": ["cuda -keys=cuda,gpu -arch=sm_70 -max_num_threads=1024 -model=unknown -thread_warp_size=32", "dense_large_batch.gpu", [["TENSOR", [128, 1024], "float32"], ["TENSOR", [1024, 1024], "float32"], null, "float32"], {}], "config": {"index": 1384254, "code_hash": null, "entity": [["tile_x", "sp", [-1, 1, 8, 2]], ["tile_y", "sp", [-1, 4, 8, 2]], ["tile_k", "sp", [-1, 4, 16]]]}, "result": [[0.00010470441652173912], 0, 2.2233400344848633, 1649858798.0300798], "version": 0.2, "tvm_version": "0.9.dev0"}
{"input": ["cuda -keys=cuda,gpu -arch=sm_70 -max_num_threads=1024 -model=unknown -thread_warp_size=32", "dense_small_batch.gpu", [["TENSOR", [128, 1024], "float32"], ["TENSOR", [1024, 1024], "float32"], null, "float32"], {}], "config": {"index": 6, "code_hash": null, "entity": [["tile_k", "sp", [-1, 64]]]}, "result": [[0.0002394716765578635], 0, 1.1961913108825684, 1649859594.4192276], "version": 0.2, "tvm_version": "0.9.dev0"}
{"input": ["cuda -keys=cuda,gpu -arch=sm_70 -max_num_threads=1024 -model=unknown -thread_warp_size=32", "dense_large_batch.gpu", [["TENSOR", [128, 1024], "float32"], ["TENSOR", [3072, 1024], "float32"], null, "float32"], {}], "config": {"index": 1932263, "code_hash": null, "entity": [["tile_x", "sp", [-1, 4, 8, 1]], ["tile_y", "sp", [-1, 8, 8, 1]], ["tile_k", "sp", [-1, 8, 2]]]}, "result": [[0.0002237060893023256], 0, 1.9841718673706055, 1649859838.550087], "version": 0.2, "tvm_version": "0.9.dev0"}
{"input": ["cuda -keys=cuda,gpu -arch=sm_70 -max_num_threads=1024 -model=unknown -thread_warp_size=32", "dense_small_batch.gpu", [["TENSOR", [128, 1024], "float32"], ["TENSOR", [3072, 1024], "float32"], null, "float32"], {}], "config": {"index": 5, "code_hash": null, "entity": [["tile_k", "sp", [-1, 32]]]}, "result": [[0.0018446505731707316], 0, 0.9782719612121582, 1649860732.6717796], "version": 0.2, "tvm_version": "0.9.dev0"}
