pre-tune_data/AutoTVM/NVIDIA V100/vit_huge.log
{"input": ["cuda -keys=cuda,gpu -arch=sm_70 -max_num_threads=1024 -model=unknown -thread_warp_size=32", "dense_small_batch.gpu", [["TENSOR", [1, 1280], "float32"], ["TENSOR", [1000, 1280], "float32"], null, "float32"], {}], "config": {"index": 13, "code_hash": null, "entity": [["tile_k", "sp", [-1, 160]]]}, "result": [[5.503420164001223e-06], 0, 1.14033842086792, 1649257285.3921719], "version": 0.2, "tvm_version": "0.9.dev0"}
{"input": ["cuda -keys=cuda,gpu -arch=sm_70 -max_num_threads=1024 -model=unknown -thread_warp_size=32", "dense_large_batch.gpu", [["TENSOR", [197, 5120], "float32"], ["TENSOR", [1280, 5120], "float32"], null, "float32"], {}], "config": {"index": 64344, "code_hash": null, "entity": [["tile_x", "sp", [-1, 1, 1, 1]], ["tile_y", "sp", [-1, 5, 1, 4]], ["tile_k", "sp", [-1, 4, 2]]]}, "result": [[0.0288406836], 0, 1.4678783416748047, 1649257940.1565995], "version": 0.2, "tvm_version": "0.9.dev0"}
{"input": ["cuda -keys=cuda,gpu -arch=sm_70 -max_num_threads=1024 -model=unknown -thread_warp_size=32", "dense_small_batch.gpu", [["TENSOR", [197, 5120], "float32"], ["TENSOR", [1280, 5120], "float32"], null, "float32"], {}], "config": {"index": 16, "code_hash": null, "entity": [["tile_k", "sp", [-1, 512]]]}, "result": [[0.005930790461538461], 0, 1.1254780292510986, 1649258461.3775694], "version": 0.2, "tvm_version": "0.9.dev0"}
{"input": ["cuda -keys=cuda,gpu -arch=sm_70 -max_num_threads=1024 -model=unknown -thread_warp_size=32", "dense_large_batch.gpu", [["TENSOR", [197, 1280], "float32"], ["TENSOR", [5120, 1280], "float32"], null, "float32"], {}], "config": {"index": 94764, "code_hash": null, "entity": [["tile_x", "sp", [-1, 1, 1, 1]], ["tile_y", "sp", [-1, 1, 1, 20]], ["tile_k", "sp", [-1, 4, 2]]]}, "result": [[0.028443798399999998], 0, 1.3668310642242432, 1649258873.7084312], "version": 0.2, "tvm_version": "0.9.dev0"}
{"input": ["cuda -keys=cuda,gpu -arch=sm_70 -max_num_threads=1024 -model=unknown -thread_warp_size=32", "dense_small_batch.gpu", [["TENSOR", [197, 1280], "float32"], ["TENSOR", [5120, 1280], "float32"], null, "float32"], {}], "config": {"index": 15, "code_hash": null, "entity": [["tile_k", "sp", [-1, 320]]]}, "result": [[0.005941833538461538], 0, 1.159123420715332, 1649259812.1971545], "version": 0.2, "tvm_version": "0.9.dev0"}
{"input": ["cuda -keys=cuda,gpu -arch=sm_70 -max_num_threads=1024 -model=unknown -thread_warp_size=32", "dense_large_batch.gpu", [["TENSOR", [197, 1024], "float32"], ["TENSOR", [1280, 1024], "float32"], null, "float32"], {}], "config": {"index": 58108, "code_hash": null, "entity": [["tile_x", "sp", [-1, 1, 1, 1]], ["tile_y", "sp", [-1, 20, 1, 1]], ["tile_k", "sp", [-1, 2, 4]]]}, "result": [[0.005747963888888889], 0, 1.2163918018341064, 1649259874.049196], "version": 0.2, "tvm_version": "0.9.dev0"}
{"input": ["cuda -keys=cuda,gpu -arch=sm_70 -max_num_threads=1024 -model=unknown -thread_warp_size=32", "dense_small_batch.gpu", [["TENSOR", [197, 1024], "float32"], ["TENSOR", [1280, 1024], "float32"], null, "float32"], {}], "config": {"index": 6, "code_hash": null, "entity": [["tile_k", "sp", [-1, 64]]]}, "result": [[0.0004490152425925926], 0, 1.1618783473968506, 1649260541.260665], "version": 0.2, "tvm_version": "0.9.dev0"}
{"input": ["cuda -keys=cuda,gpu -arch=sm_70 -max_num_threads=1024 -model=unknown -thread_warp_size=32", "dense_large_batch.gpu", [["TENSOR", [197, 1280], "float32"], ["TENSOR", [3072, 1280], "float32"], null, "float32"], {}], "config": {"index": 9968, "code_hash": null, "entity": [["tile_x", "sp", [-1, 1, 1, 1]], ["tile_y", "sp", [-1, 12, 1, 2]], ["tile_k", "sp", [-1, 4, 1]]]}, "result": [[0.0171522172], 0, 1.170281171798706, 1649260786.5907233], "version": 0.2, "tvm_version": "0.9.dev0"}
{"input": ["cuda -keys=cuda,gpu -arch=sm_70 -max_num_threads=1024 -model=unknown -thread_warp_size=32", "dense_small_batch.gpu", [["TENSOR", [197, 1280], "float32"], ["TENSOR", [3072, 1280], "float32"], null, "float32"], {}], "config": {"index": 15, "code_hash": null, "entity": [["tile_k", "sp", [-1, 320]]]}, "result": [[0.003567985093023256], 0, 1.0277814865112305, 1649261461.6082997], "version": 0.2, "tvm_version": "0.9.dev0"}
{"input": ["cuda -keys=cuda,gpu -arch=sm_70 -max_num_threads=1024 -model=unknown -thread_warp_size=32", "dense_large_batch.gpu", [["TENSOR", [196, 768], "float32"], ["TENSOR", [1280, 768], "float32"], null, "float32"], {}], "config": {"index": 241578, "code_hash": null, "entity": [["tile_x", "sp", [-1, 1, 1, 14]], ["tile_y", "sp", [-1, 1, 1, 10]], ["tile_k", "sp", [-1, 4, 1]]]}, "result": [[0.0011639569767441862], 0, 1.2681872844696045, 1649262448.4364564], "version": 0.2, "tvm_version": "0.9.dev0"}
{"input": ["cuda -keys=cuda,gpu -arch=sm_70 -max_num_threads=1024 -model=unknown -thread_warp_size=32", "dense_small_batch.gpu", [["TENSOR", [196, 768], "float32"], ["TENSOR", [1280, 768], "float32"], null, "float32"], {}], "config": {"index": 9, "code_hash": null, "entity": [["tile_k", "sp", [-1, 32]]]}, "result": [[0.00039550776182707996], 0, 1.2077109813690186, 1649262488.745903], "version": 0.2, "tvm_version": "0.9.dev0"}
